<?xml version="1.0" encoding="utf-8" ?>
<application xmlns:xsi="http://www.w3.org/2001/XMLSchema-instance"
             xsi:noNamespaceSchemaLocation="http://www.astorm.ch/masapi/masapiFileDependencies.xsd">
	<files>
		<file name="fonts" 	url="swf/fonts.swf" global="true" type="swf" 			virtualBytesTotal="35000" />
		<file name="menu"  	url="swf/menu.swf"  global="true" type="binary" 		virtualBytesTotal="20000" />
		<file name="menuData" 	url="data/menu.xml" 						virtualBytesTotal="2000" />
		<file name="menuMotion" url="data/menuMotion.xml" 					virtualBytesTotal="2000" />
		<file name="page1" 	url="swf/pages/page1.swf" 					virtualBytesTotal="5000" />
		<file name="page2" 	url="swf/pages/page2.swf" 					virtualBytesTotal="8000" />
		<file name="fontsTexte" url="swf/pages/fontsTexte.swf" type="swf" 			virtualBytesTotal="80000" />
		<file name="page1Texte" url="data/texte_page1.txt" type="variables" 			virtualBytesTotal="10000" />
		<file name="logoAdobe" 	url="data/adobe.png" type="swf" 				virtualBytesTotal="45000" />
		<file name="texteAdobe" url="data/titreAdobe.txt" type="text" 				virtualBytesTotal="2000" />
	</files>
	<dependencies>
		<file name="menu">
			<file name="menuMotion" />
			<file name="menuData" />
		</file>
		<file name="page1">
			<file name="fontsTexte" />
			<file name="page1Texte" />
		</file>
		<file name="page2">
			<file name="fontsTexte" />
			<file name="logoAdobe" />
			<file name="texteAdobe" />
		</file>
	</dependencies>
</application>